{
  "api_version": "omnisupport.ai/v2",
  "kind": "GovernedRelease",
  "metadata": {
    "release_id": "omni-dev-v2026.08.24-001",
    "environment": "dev",
    "created_at": "2026-08-24T02:15:58.493430+00:00",
    "created_by": "yangong",
    "approved_by": null,
    "git_sha": "1473db6dfa785487e1a0f87bb97bdfec6719725c",
    "previous_release_id": null,
    "previous_manifest_digest": null
  },
  "spec": {
    "components": {
      "data": {
        "release_id": "data-capstone-v1",
        "lakefs_repository": "omnisupport-data",
        "lakefs_ref": "refs/tags/data-capstone-v1",
        "iceberg_snapshot_ids": {
          "bronze.ticket_event": "capstone-v1",
          "silver.ticket_current": "capstone-v1"
        },
        "artifact_digests": {
          "assignments/final_capstone/yangong/reports/baseline_component_bindings.json": "sha256:7dabbdec185afb6afd6bbfdccec0fbe9aed3be5f8bed0422434eb0d2cd07ab2f"
        }
      },
      "index": {
        "release_id": "index-capstone-v1",
        "data_release_id": "data-capstone-v1",
        "embedding_model": "deterministic-hash-embedding-v1@1536",
        "artifact_digests": {
          "assignments/final_capstone/yangong/reports/baseline_component_bindings.json": "sha256:7dabbdec185afb6afd6bbfdccec0fbe9aed3be5f8bed0422434eb0d2cd07ab2f"
        }
      },
      "prompt": {
        "release_id": "prompt-capstone-v1",
        "template_versions": {
          "answer": "answer_v1",
          "no_answer": "no_answer_v1"
        },
        "artifact_digests": {
          "services/rag_api/app/prompts/answer_v1.md": "sha256:5adcef9387e4c33961635ac17dab02aa76a50f6b8b27799b3a33ec056c13b70d",
          "services/rag_api/app/prompts/no_answer_v1.md": "sha256:13cf3fbf307b645f58950fa223a44799521e21cf8ce510c7b7a4d5ededb9c8c6"
        }
      },
      "model": {
        "release_id": "model-deterministic-fallback-v1",
        "provider": "fallback",
        "model_id": "deterministic-grounded-template-v1",
        "snapshot": "git:1473db6dfa785487e1a0f87bb97bdfec6719725c",
        "system_card": "assignments/final_capstone/yangong/reports/baseline_component_bindings.json",
        "models": {
          "generation": "deterministic-grounded-template-v1",
          "embedding": "deterministic-hash-embedding-v1",
          "rerank": "disabled"
        },
        "artifact_digests": {
          "assignments/final_capstone/yangong/reports/baseline_component_bindings.json": "sha256:7dabbdec185afb6afd6bbfdccec0fbe9aed3be5f8bed0422434eb0d2cd07ab2f"
        }
      },
      "skills": {
        "release_id": "skills-capstone-existing-v1",
        "packs": [
          "add_internal_note@existing",
          "grant_service_credit@existing"
        ],
        "artifact_digests": {
          "contracts/tools/tool_contract_schema.json": "sha256:8c0c04e9060992d230144e4b01ea5a25ccf211009e354adbcc9343a5f315cf24",
          "contracts/tools/tools/ticket_update.json": "sha256:cecf0637c294f560287221b37886c83b2c001e964bf5c86a21af4c1ae349f532"
        }
      },
      "graph": {
        "release_id": "graph-capstone-prechange-v1",
        "schema_version": "graph_schema_v1",
        "artifact_digests": {
          "assignments/final_capstone/yangong/reports/baseline_component_bindings.json": "sha256:7dabbdec185afb6afd6bbfdccec0fbe9aed3be5f8bed0422434eb0d2cd07ab2f"
        }
      },
      "service": {
        "release_id": "service-capstone-v1",
        "components": [
          "rag_api",
          "tool_api",
          "copilot_api",
          "copilot_console"
        ],
        "feature_flags": {
          "solution_card": false
        },
        "artifact_digests": {
          "assignments/final_capstone/yangong/reports/baseline_component_bindings.json": "sha256:7dabbdec185afb6afd6bbfdccec0fbe9aed3be5f8bed0422434eb0d2cd07ab2f"
        }
      }
    },
    "quality": {
      "eval": {
        "run_id": "e2e-baseline-legacy",
        "gate_status": "pass",
        "report_path": "assignments/final_capstone/yangong/reports/raw/e2e-baseline-legacy.json",
        "artifact_digests": {
          "assignments/final_capstone/yangong/reports/raw/e2e-baseline-legacy.json": "sha256:9ad009397661f574bf314bf97918f32466733cb937bb62f0a5d04cbf0ce8304e"
        }
      }
    },
    "business_slo": {
      "policy_id": "week12-slo-v1",
      "status": "pass",
      "artifact_digests": {
        "observability/slo/week12_slo.yaml": "sha256:49c4b2356e7cd56bd715826e9f924c8c851993d8ccbb5ecd3ab829d40f59472d"
      }
    },
    "rollout": {
      "stages": [
        {
          "traffic_percent": 5,
          "min_samples": 1,
          "min_observation_minutes": 1,
          "gates": [
            {
              "metric": "legacy_e2e_pass",
              "operator": ">=",
              "threshold": 1
            }
          ],
          "baseline_guards": [
            {
              "metric": "unsafe_action_bypass_count",
              "operator": "<=",
              "threshold": 0
            }
          ]
        },
        {
          "traffic_percent": 25,
          "min_samples": 1,
          "min_observation_minutes": 1,
          "gates": [
            {
              "metric": "legacy_e2e_pass",
              "operator": ">=",
              "threshold": 1
            }
          ],
          "baseline_guards": [
            {
              "metric": "unsafe_action_bypass_count",
              "operator": "<=",
              "threshold": 0
            }
          ]
        },
        {
          "traffic_percent": 50,
          "min_samples": 1,
          "min_observation_minutes": 1,
          "gates": [
            {
              "metric": "legacy_e2e_pass",
              "operator": ">=",
              "threshold": 1
            }
          ],
          "baseline_guards": [
            {
              "metric": "unsafe_action_bypass_count",
              "operator": "<=",
              "threshold": 0
            }
          ]
        },
        {
          "traffic_percent": 100,
          "min_samples": 1,
          "min_observation_minutes": 1,
          "gates": [
            {
              "metric": "legacy_e2e_pass",
              "operator": ">=",
              "threshold": 1
            }
          ],
          "baseline_guards": [
            {
              "metric": "unsafe_action_bypass_count",
              "operator": "<=",
              "threshold": 0
            }
          ]
        }
      ],
      "red_lines": [
        {
          "metric": "unsafe_action_bypass_count",
          "operator": ">",
          "threshold": 0
        }
      ]
    },
    "governance": {
      "change_ticket": "CHG-FINAL-CAPSTONE-BASELINE",
      "data_classification": "internal",
      "required_approvals": [
        "release_owner",
        "service_owner"
      ]
    }
  },
  "integrity": {
    "manifest_digest": "sha256:ab17254254181897787df97a591c47a0fc4aeeac652fa2225acf8712204d6d3f",
    "signature": {
      "algorithm": "none",
      "key_id": null,
      "value": null
    }
  }
}
